volume	part	number	page	auth	titl	oreg	odat	id	dreg	claimants	previous	new_matter	see_also_ren	see_also_reg	note	full_text
					The Kandy-kolored tangerine-flake streamline baby.	A777680	1956-06-28	RE638409	1993-08-02	Thomas K. Wolfe, Jr.|A						
				George Gaylord Simpson, author of renewable matter: Time Warner, Inc.	Attending marvels, a Patagonian journal.	A802578	1963-10-05	RE627867	1993-06-24	Time Life, Inc.|PWH						
				Elizabeth Spencer, author of renewable matter: Time Warner, Inc.	The Voice at the back door.	A802579	1963-10-05	RE627868	1993-06-24	Time Life, Inc.|PWH						
				Laurie Lee, author of renewable matter: Time Warner, Inc.	The Edge of day.	A802580	1963-10-05	RE627869	1993-06-24	Time Life, Inc.|PWH						
				John Cheever, author of renewable matter: Time Warner, Inc.	The Wapshot chronicle.	A802581	1963-10-05	RE627870	1993-06-24	Time Life, Inc.|PWH						
